{
  "contractVersion": "2.0.0",
  "measurementId": "measurement-version-mismatch",
  "subjectRef": "reality-object-204-room-shell",
  "quantity": "width",
  "value": 4.21,
  "unit": "m",
  "status": "OBSERVED",
  "method": "manual tape measurement",
  "evidenceContentIds": [],
  "measuredAt": "2026-01-15T09:52:03.000Z"
}
